{
  "schemaVersion": 1,
  "id": "missing-reviewer-review-gap",
  "case": "missing-reviewer",
  "title": "Required reviewer missing after multi layer change",
  "sanitized": true,
  "source": "synthetic-regression-pattern",
  "runtime": "claude",
  "task": {
    "id": "refactor-provider-boundary",
    "type": "refactor",
    "riskTier": "high-risk",
    "acceptance": ["provider-boundary-preserved", "architecture-review-pass"]
  },
  "outcome": {
    "status": "blocked",
    "failureClass": "architecture-drift",
    "blockedBy": ["architecture-reviewer", "review-coverage"]
  },
  "modelRouting": {
    "lane": "high-risk",
    "model": "claude-sonnet-4-6",
    "expectedModel": "claude-sonnet-4-6",
    "success": false,
    "costUsd": 0.074,
    "inputTokens": 9100,
    "outputTokens": 2600
  },
  "evalSignals": [
    {
      "id": "review-coverage",
      "kind": "review",
      "status": "blocked",
      "summary": "Architecture reviewer decision was required but missing."
    },
    {
      "id": "scope-analysis",
      "kind": "gate",
      "status": "warning",
      "summary": "Diff touched service, runtime, and provider layers."
    }
  ],
  "events": [
    {
      "step": 1,
      "actor": "agent",
      "event": "refactor-completed",
      "summary": "Agent completed a multi layer refactor."
    },
    {
      "step": 2,
      "actor": "harness",
      "event": "review-triggered",
      "summary": "Changed layers triggered architecture review coverage."
    },
    {
      "step": 3,
      "actor": "harness",
      "event": "completion-blocked",
      "summary": "Completion was blocked until reviewer evidence existed."
    }
  ],
  "redactions": [
    {
      "kind": "repo",
      "replacement": "repo://demo"
    }
  ]
}
